{
  "$schema": "./_schema.schema.json",
  "contractVersion": 2,
  "schemaVersion": 3,
  "consumerVersion": 3,
  "domain": "lemeng",
  "table": "retail_order_line",
  "owner": "data-platform",
  "description": "乐檬零售订单明细行（posorder.find 拉回后管线内 UNNEST 成行粒度）。两账套各采各的；作废/取消单照采，口径在 marts。2026-09-29 列集 v2（#294）：18→24 列，补采 6 个对账字段（订单级 order_transaction_type / order_ref_billno，明细级 order_detail_share_discount / order_detail_std_price / order_detail_price / order_detail_online_qty）——该次**只增列、未动契约格式**。2026-10-05 列集 v3（#430）：24→25 列，补采订单级 order_total_money —— 平台 sale_money 口径的换货半边靠它算；同样**只增列、未动契约格式**。⚠️ 上面两处「未动契约格式」指的是**那两次列集变更发生时**；**2026-10-06（#460）起契约格式已升 v2**（`contractVersion: 2`，列上新增 `expr` 供生成器产出投影），别读成当前仍是 v1。",
  "layout": {
    "prefix": "lemeng/retail_order_line",
    "partitionStyle": "hive",
    "partitionBy": ["system_book", "bizday", "hour"],
    "fileName": "all.parquet"
  },
  "batch": {
    "markerColumn": "batch_id",
    "type": "varchar",
    "unique": false,
    "note": "= 采集 run id（job wrapper 生成：retail-<UTC时间戳>-<窗口标识>）。同窗重跑换新 run id，幂等靠对象覆盖写。"
  },
  "columns": [
    { "name": "batch_id", "type": "varchar", "nullable": false, "description": "批次标记（采集 run id）", "expr": "'${ITER_ITEM_BATCH_ID}'" },
    { "name": "system_book", "type": "varchar", "nullable": false, "description": "账套（3120/64188）；分区键，来源=**采集侧按账套常量注入**（管线 env `SYSTEM_BOOK`，见 **在用的** L1 子管线 deploy/duckle/console/pipelines/lemeng.retail_order_line.window.json 的 code.sql 节点；🔴 2026-09-29 改向，原指已退役的 duckle/common/lemeng.retail_order_line.json）——**不是**取自明细行的 system_book_code（该字段网关确实返回，但不在本契约 18 列内）", "expr": "'${ITER_ITEM_SYSTEM_BOOK}'" },
    { "name": "bizday", "type": "date", "nullable": false, "description": "营业日（shift_table_bizday，YYYYMMDD 落盘即定型为 date）；分区键", "expr": "CAST(strptime(json_extract_string(u.d, '$.order_detail_bizday'), '%Y%m%d') AS DATE)" },
    { "name": "hour", "type": "integer", "nullable": false, "description": "成交时间所在小时（0-23）；分区键，由 order_time 推导", "expr": "CAST(date_part('hour', CAST(o.order_time AS TIMESTAMP)) AS INTEGER)" },
    { "name": "order_no", "type": "varchar", "nullable": false, "description": "订单号（自然键之一）", "expr": "CAST(o.order_no AS VARCHAR)" },
    { "name": "order_detail_num", "type": "varchar", "nullable": false, "description": "明细行号（自然键之一）", "expr": "CAST(json_extract_string(u.d, '$.order_detail_num') AS VARCHAR)" },
    { "name": "branch_num", "type": "integer", "nullable": false, "description": "门店号（账套内编号）", "expr": "CAST(json_extract_string(u.d, '$.branch_num') AS INTEGER)" },
    { "name": "branch_name", "type": "varchar", "nullable": true, "description": "门店名", "expr": "json_extract_string(CAST(o.branch AS JSON), '$.branch_name')" },
    { "name": "order_time", "type": "timestamp", "nullable": true, "description": "成交时间", "expr": "CAST(o.order_time AS TIMESTAMP)" },
    { "name": "order_operate_time", "type": "timestamp", "nullable": true, "description": "操作时间", "expr": "CAST(o.order_operate_time AS TIMESTAMP)" },
    { "name": "state", "type": "varchar", "nullable": false, "description": "单据状态（FINISHED/CANCELED/REPAID/…）", "expr": "CAST(o.state AS VARCHAR)" },
    { "name": "order_source", "type": "varchar", "nullable": true, "description": "订单来源", "expr": "CAST(o.order_source AS VARCHAR)" },
    { "name": "item_num", "type": "varchar", "nullable": false, "description": "商品号（账套内编号，varchar 防撑爆）", "expr": "CAST(json_extract_string(u.d, '$.item_num') AS VARCHAR)" },
    { "name": "item_code", "type": "varchar", "nullable": true, "description": "商品业务码。⚠️ 上游订单 API 无此字段（PosOrderDetailAiVO / PosOrderAiVO 均无，2026-09-28 归因 §5.1 核验），本列恒空串；跨品牌归并键职责由 dim_item.item_code 承担（join 键 item_num）", "expr": "json_extract_string(u.d, '$.item_code')" },
    { "name": "sale_money", "type": "decimal", "precision": 14, "scale": 2, "nullable": true, "description": "行成交金额（元）", "expr": "CAST(json_extract_string(u.d, '$.order_detail_money') AS DECIMAL(14,2))" },
    { "name": "discount_money", "type": "decimal", "precision": 14, "scale": 2, "nullable": true, "description": "行折扣金额（元）", "expr": "CAST(json_extract_string(u.d, '$.order_detail_discount') AS DECIMAL(14,2))" },
    { "name": "payment_money", "type": "decimal", "precision": 14, "scale": 2, "nullable": true, "description": "行收款金额（元）", "expr": "CAST(json_extract_string(u.d, '$.order_detail_payment_money') AS DECIMAL(14,2))" },
    { "name": "quantity", "type": "decimal", "precision": 14, "scale": 3, "nullable": true, "description": "行数量", "expr": "CAST(json_extract_string(u.d, '$.order_detail_amount') AS DECIMAL(14,3))" },
    { "name": "order_transaction_type", "type": "varchar", "nullable": true, "description": "订单交易类型（订单级：SALE_ORDER / PARTIAL_ORDER_RETURN / FULL_ORDER_RETURN / NO_ORDER_RETURN）。⚠️ 2026-10-05 订正：旧描述「非 SALE 订单行金额逐分等于平台 return_money」**会误导**——平台的 sale_money **不冲减退货单**（退货单只是不进 gross），且**同一张 SALE_ORDER 内部也可能装着换货的退回行**（靠本列看不出来）。口径正典见 issue #430。⚠️ 2026-10-17 补充（issue #813）：平台的**净销售额**已改为「销售侧 − 退货侧」，退货侧取 `like '%RETURN%' AND state='FINISHED'` 的行（**REPAID_RETURN 不计**），按**退货单自身 bizday** 归属。v2（#294）补采", "expr": "CAST(o.order_transaction_type AS VARCHAR)" },
    { "name": "order_ref_billno", "type": "varchar", "nullable": true, "description": "退货关联原单号（订单级，仅退货类订单有值）。⚠️ 2026-10-05 起**对账不再依赖它**：平台 sale_money 不按原单日冲减退货（issue #430）。v2（#294）补采", "expr": "CAST(o.order_ref_billno AS VARCHAR)" },
    { "name": "order_detail_share_discount", "type": "decimal", "precision": 14, "scale": 2, "nullable": true, "description": "订单明细分摊金额（官方语义确认；分支级 sd 可由它自算，摆脱报表依赖。真机非满员：43/67 行有值）。v2（#294）补采", "expr": "CAST(json_extract_string(u.d, '$.order_detail_share_discount') AS DECIMAL(14,2))" },
    { "name": "order_detail_std_price", "type": "decimal", "precision": 14, "scale": 2, "nullable": true, "description": "明细标准价（复核折扣/改价口径；真机 67/67 行有值）。v2（#294）补采", "expr": "CAST(json_extract_string(u.d, '$.order_detail_std_price') AS DECIMAL(14,2))" },
    { "name": "order_detail_price", "type": "decimal", "precision": 14, "scale": 2, "nullable": true, "description": "明细售价（复核折扣/改价口径；真机 67/67 行有值）。v2（#294）补采", "expr": "CAST(json_extract_string(u.d, '$.order_detail_price') AS DECIMAL(14,2))" },
    { "name": "order_detail_online_qty", "type": "decimal", "precision": 14, "scale": 3, "nullable": true, "description": "线上单规格换算数量（团购渠道；真机 67/67 行有值）。v2（#294）补采", "expr": "CAST(json_extract_string(u.d, '$.order_detail_online_qty') AS DECIMAL(14,3))" },
    { "name": "order_total_money", "type": "decimal", "precision": 14, "scale": 2, "nullable": true, "description": "订单级总额（元，订单级字段逐行冗余）。**换货判别的事实源**：换货单的「送出半边」= (Σ非赠品行额 + order_total_money) / 2 —— 等价换货（礼盒↔散货）总额 0 ⇒ Σ/2；差价换货（退 A 换 B 补差）总额 = 净补差 ⇒ (Σ+总额)/2。真机 2026-10-05 实测：带它后 4 天 × 13 店逐分归零（issue #430）。v3 补采", "expr": "CAST(o.order_total_money AS DECIMAL(14,2))" }
  ]
}
