{
  "$schema": "./_schema.schema.json",
  "contractVersion": 2,
  "schemaVersion": 1,
  "consumerVersion": 1,
  "domain": "lemeng",
  "table": "branch",
  "owner": "data-platform",
  "description": "乐檬门店维（nhsoft.user.ai.branch.find 全量快照）。两账套各采各的；快照自愈（改名/停用无需增量游标）。【行粒度】一行 = 一个账套在一个快照日的一个门店；自然键 `(system_book, snapshot, branch_num)`（全量快照日更 ⇒ 湖里的行粒度含 `snapshot` 分区键；`(system_book, branch_num)` 是实体粒度，不是行粒度）。【容量】管线总 5 页（4 个数据页 + 1 个哨兵页），page_size=200 ⇒ 真阈值 = 4×200 = 800 家/账套（哨兵页不计容量，口径同 spec §6）。页数硬编码、哨兵页是唯一防线；命中 = 当日该账套快照 fail-loud 中止（不静默丢数）。扩页数 = 加数据页节点 + 同步算式与哨兵页 page_number + 重生成 data-plane lock + 走 PR。【layout 说明】prefix 写 `lemeng/dim_branch`（本域维度表落湖一律带 `dim_` 段——spec §5 湖布局即如此），故它**不等于** `domain/table`（= `lemeng/branch`）—— 契约元 schema `$comment` 第 ② 条要求的正是那条等式，在本域按既有口径**不成立**；`table` 保持 `branch`（文件名 `lemeng.branch.json`、staging 名 `stg_lemeng_branch`、gate 规则④的合成名都由它钉死）。这不是笔误，登记在此避免被当成笔误改掉。",
  "layout": {
    "prefix": "lemeng/dim_branch",
    "partitionStyle": "hive",
    "partitionBy": ["system_book", "snapshot"],
    "fileName": "all.parquet"
  },
  "batch": {
    "markerColumn": "batch_id",
    "type": "varchar",
    "unique": false,
    "note": "= 采集 run id（job wrapper 生成）。同快照重跑换新 run id，幂等靠对象覆盖写。"
  },
  "columns": [
    { "name": "batch_id",   "type": "varchar", "nullable": false, "description": "批次标记", "expr": "'dim-' || '${ENV:SYSTEM_BOOK}' || '-branch-' || replace(replace('${datetime}','-',''),'_','T') || 'Z'" },
    { "name": "system_book","type": "varchar", "nullable": false, "description": "账套（3120/64188）；分区键，来源=采集侧常量注入（`ENV:SYSTEM_BOOK`）", "expr": "'${ENV:SYSTEM_BOOK}'" },
    { "name": "snapshot",   "type": "date",    "nullable": false, "description": "快照日（Asia/Shanghai 日历日）；分区键", "expr": "CAST('${date+8h}' AS DATE)" },
    { "name": "branch_num", "type": "integer", "nullable": false, "description": "门店号（账套内编号）；自然键之一", "expr": "CAST(o.branch_num AS INTEGER)" },
    { "name": "code",       "type": "varchar", "nullable": true,  "description": "门店编码", "expr": "CAST(o.code AS VARCHAR)" },
    { "name": "name",       "type": "varchar", "nullable": true,  "description": "门店名", "expr": "CAST(o.name AS VARCHAR)" },
    { "name": "pinyin",     "type": "varchar", "nullable": true,  "description": "拼音码", "expr": "CAST(o.pinyin AS VARCHAR)" },
    { "name": "type",       "type": "varchar", "nullable": true,  "description": "门店类型", "expr": "CAST(o.type AS VARCHAR)" },
    { "name": "enable",     "type": "boolean", "nullable": true,  "description": "是否启用", "expr": "CAST(o.enable AS BOOLEAN)" },
    { "name": "region_id",  "type": "integer", "nullable": true,  "description": "区域 id（账套内；公司统一区域走平台主数据，spec §7.2）", "expr": "CAST(o.region_id AS INTEGER)" },
    { "name": "province",   "type": "varchar", "nullable": true,  "description": "省", "expr": "CAST(o.province AS VARCHAR)" },
    { "name": "city",       "type": "varchar", "nullable": true,  "description": "市", "expr": "CAST(o.city AS VARCHAR)" },
    { "name": "district",   "type": "varchar", "nullable": true,  "description": "区县", "expr": "CAST(o.district AS VARCHAR)" },
    { "name": "contact",    "type": "varchar", "nullable": true,  "description": "联系人", "expr": "CAST(o.contact AS VARCHAR)" },
    { "name": "phone",      "type": "varchar", "nullable": true,  "description": "电话", "expr": "CAST(o.phone AS VARCHAR)" },
    { "name": "address",    "type": "varchar", "nullable": true,  "description": "地址", "expr": "CAST(o.address AS VARCHAR)" }
  ]
}
